{
  "$schema": "https://json-schema.org/draft/2020-12/schema",
  "$id": "https://example.invalid/aps/plan-problem.schema.json",
  "title": "PlanProblem v1",
  "type": "object",
  "additionalProperties": false,
  "required": [
    "meta",
    "machines",
    "workers",
    "tools",
    "materials",
    "orders",
    "objective"
  ],
  "properties": {
    "meta": {
      "type": "object",
      "additionalProperties": false,
      "required": [
        "schema_version",
        "tenant_id",
        "site_id",
        "snapshot_id",
        "timezone",
        "horizon_start",
        "horizon_end",
        "resolution_min"
      ],
      "properties": {
        "schema_version": {
          "const": "plan-problem/1.0"
        },
        "tenant_id": {
          "type": "string",
          "minLength": 1
        },
        "site_id": {
          "type": "string",
          "minLength": 1
        },
        "snapshot_id": {
          "type": "string",
          "minLength": 1
        },
        "timezone": {
          "type": "string",
          "minLength": 1
        },
        "horizon_start": {
          "type": "string",
          "format": "date-time"
        },
        "horizon_end": {
          "type": "string",
          "format": "date-time"
        },
        "resolution_min": {
          "type": "integer",
          "minimum": 1
        }
      }
    },
    "machines": {
      "type": "array",
      "minItems": 1,
      "items": {
        "type": "object",
        "additionalProperties": false,
        "required": [
          "id",
          "capabilities",
          "available",
          "blocked"
        ],
        "properties": {
          "id": {
            "type": "string",
            "minLength": 1
          },
          "capabilities": {
            "type": "array",
            "minItems": 1,
            "items": {
              "type": "string",
              "minLength": 1
            }
          },
          "available": {
            "type": "array",
            "items": {
              "type": "object",
              "additionalProperties": false,
              "required": [
                "start",
                "end"
              ],
              "properties": {
                "start": {
                  "type": "string",
                  "format": "date-time"
                },
                "end": {
                  "type": "string",
                  "format": "date-time"
                },
                "reason": {
                  "type": "string"
                }
              }
            }
          },
          "blocked": {
            "type": "array",
            "items": {
              "type": "object",
              "additionalProperties": false,
              "required": [
                "start",
                "end"
              ],
              "properties": {
                "start": {
                  "type": "string",
                  "format": "date-time"
                },
                "end": {
                  "type": "string",
                  "format": "date-time"
                },
                "reason": {
                  "type": "string"
                }
              }
            }
          }
        }
      }
    },
    "workers": {
      "type": "array",
      "minItems": 1,
      "items": {
        "type": "object",
        "additionalProperties": false,
        "required": [
          "id",
          "skills",
          "qualifications",
          "available",
          "blocked"
        ],
        "properties": {
          "id": {
            "type": "string",
            "minLength": 1
          },
          "skills": {
            "type": "array",
            "items": {
              "type": "string",
              "minLength": 1
            }
          },
          "qualifications": {
            "type": "array",
            "items": {
              "type": "string",
              "minLength": 1
            }
          },
          "available": {
            "type": "array",
            "items": {
              "type": "object",
              "additionalProperties": false,
              "required": [
                "start",
                "end"
              ],
              "properties": {
                "start": {
                  "type": "string",
                  "format": "date-time"
                },
                "end": {
                  "type": "string",
                  "format": "date-time"
                },
                "reason": {
                  "type": "string"
                }
              }
            }
          },
          "blocked": {
            "type": "array",
            "items": {
              "type": "object",
              "additionalProperties": false,
              "required": [
                "start",
                "end"
              ],
              "properties": {
                "start": {
                  "type": "string",
                  "format": "date-time"
                },
                "end": {
                  "type": "string",
                  "format": "date-time"
                },
                "reason": {
                  "type": "string"
                }
              }
            }
          }
        }
      }
    },
    "tools": {
      "type": "array",
      "items": {
        "type": "object",
        "additionalProperties": false,
        "required": [
          "id",
          "capacity"
        ],
        "properties": {
          "id": {
            "type": "string",
            "minLength": 1
          },
          "capacity": {
            "const": 1
          }
        }
      }
    },
    "materials": {
      "type": "array",
      "items": {
        "type": "object",
        "additionalProperties": false,
        "required": [
          "id",
          "initial_quantity",
          "receipts"
        ],
        "properties": {
          "id": {
            "type": "string",
            "minLength": 1
          },
          "initial_quantity": {
            "type": "integer",
            "minimum": 0
          },
          "receipts": {
            "type": "array",
            "items": {
              "type": "object",
              "additionalProperties": false,
              "required": [
                "at",
                "quantity"
              ],
              "properties": {
                "at": {
                  "type": "string",
                  "format": "date-time"
                },
                "quantity": {
                  "type": "integer",
                  "minimum": 1
                }
              }
            }
          }
        }
      }
    },
    "orders": {
      "type": "array",
      "minItems": 1,
      "items": {
        "type": "object",
        "additionalProperties": false,
        "required": [
          "id",
          "quantity",
          "priority",
          "release_at",
          "due_at",
          "operations"
        ],
        "properties": {
          "id": {
            "type": "string",
            "minLength": 1
          },
          "quantity": {
            "type": "integer",
            "minimum": 1
          },
          "priority": {
            "type": "integer",
            "minimum": 1
          },
          "release_at": {
            "type": "string",
            "format": "date-time"
          },
          "due_at": {
            "type": "string",
            "format": "date-time"
          },
          "operations": {
            "type": "array",
            "minItems": 1,
            "items": {
              "type": "object",
              "additionalProperties": false,
              "required": [
                "id",
                "predecessors",
                "skill",
                "qualifications",
                "worker_count",
                "alternatives",
                "tools",
                "materials"
              ],
              "properties": {
                "id": {
                  "type": "string",
                  "minLength": 1
                },
                "predecessors": {
                  "type": "array",
                  "uniqueItems": true,
                  "items": {
                    "type": "string",
                    "minLength": 1
                  }
                },
                "skill": {
                  "type": "string",
                  "minLength": 1
                },
                "qualifications": {
                  "type": "array",
                  "uniqueItems": true,
                  "items": {
                    "type": "string",
                    "minLength": 1
                  }
                },
                "worker_count": {
                  "const": 1
                },
                "alternatives": {
                  "type": "array",
                  "minItems": 1,
                  "items": {
                    "type": "object",
                    "required": [
                      "machine_id",
                      "duration_min"
                    ],
                    "additionalProperties": false,
                    "properties": {
                      "machine_id": {
                        "type": "string",
                        "minLength": 1
                      },
                      "duration_min": {
                        "type": "integer",
                        "minimum": 1
                      }
                    }
                  }
                },
                "tools": {
                  "type": "array",
                  "uniqueItems": true,
                  "items": {
                    "type": "string",
                    "minLength": 1
                  }
                },
                "materials": {
                  "type": "object",
                  "additionalProperties": {
                    "type": "integer",
                    "minimum": 1
                  }
                }
              }
            }
          }
        }
      }
    },
    "objective": {
      "type": "object",
      "additionalProperties": false,
      "required": [
        "strategy",
        "phases",
        "time_limit_ms",
        "seed"
      ],
      "properties": {
        "strategy": {
          "enum": [
            "lexicographic",
            "makespan"
          ]
        },
        "phases": {
          "type": "array",
          "items": {
            "enum": [
              "weighted_tardiness",
              "makespan"
            ]
          }
        },
        "time_limit_ms": {
          "type": "integer",
          "minimum": 1
        },
        "seed": {
          "type": "integer",
          "minimum": 0
        }
      }
    }
  }
}
