{
  "meta": {
    "schema_version": "plan-problem/1.0",
    "tenant_id": "mock-tenant-alpha",
    "site_id": "mock-factory-one",
    "snapshot_id": "snapshot-material-delay-v1",
    "timezone": "America/Los_Angeles",
    "horizon_start": "2026-10-05T08:00:00-07:00",
    "horizon_end": "2026-10-09T17:00:00-07:00",
    "resolution_min": 15
  },
  "machines": [
    {
      "id": "CUT-01",
      "capabilities": [
        "cut"
      ],
      "available": [
        {
          "start": "2026-10-05T08:00:00-07:00",
          "end": "2026-10-05T12:00:00-07:00"
        },
        {
          "start": "2026-10-05T13:00:00-07:00",
          "end": "2026-10-05T17:00:00-07:00"
        },
        {
          "start": "2026-10-06T08:00:00-07:00",
          "end": "2026-10-06T12:00:00-07:00"
        },
        {
          "start": "2026-10-06T13:00:00-07:00",
          "end": "2026-10-06T17:00:00-07:00"
        },
        {
          "start": "2026-10-07T08:00:00-07:00",
          "end": "2026-10-07T12:00:00-07:00"
        },
        {
          "start": "2026-10-07T13:00:00-07:00",
          "end": "2026-10-07T17:00:00-07:00"
        },
        {
          "start": "2026-10-08T08:00:00-07:00",
          "end": "2026-10-08T12:00:00-07:00"
        },
        {
          "start": "2026-10-08T13:00:00-07:00",
          "end": "2026-10-08T17:00:00-07:00"
        },
        {
          "start": "2026-10-09T08:00:00-07:00",
          "end": "2026-10-09T12:00:00-07:00"
        },
        {
          "start": "2026-10-09T13:00:00-07:00",
          "end": "2026-10-09T17:00:00-07:00"
        }
      ],
      "blocked": []
    },
    {
      "id": "CUT-02",
      "capabilities": [
        "cut"
      ],
      "available": [
        {
          "start": "2026-10-05T08:00:00-07:00",
          "end": "2026-10-05T12:00:00-07:00"
        },
        {
          "start": "2026-10-05T13:00:00-07:00",
          "end": "2026-10-05T17:00:00-07:00"
        },
        {
          "start": "2026-10-06T08:00:00-07:00",
          "end": "2026-10-06T12:00:00-07:00"
        },
        {
          "start": "2026-10-06T13:00:00-07:00",
          "end": "2026-10-06T17:00:00-07:00"
        },
        {
          "start": "2026-10-07T08:00:00-07:00",
          "end": "2026-10-07T12:00:00-07:00"
        },
        {
          "start": "2026-10-07T13:00:00-07:00",
          "end": "2026-10-07T17:00:00-07:00"
        },
        {
          "start": "2026-10-08T08:00:00-07:00",
          "end": "2026-10-08T12:00:00-07:00"
        },
        {
          "start": "2026-10-08T13:00:00-07:00",
          "end": "2026-10-08T17:00:00-07:00"
        },
        {
          "start": "2026-10-09T08:00:00-07:00",
          "end": "2026-10-09T12:00:00-07:00"
        },
        {
          "start": "2026-10-09T13:00:00-07:00",
          "end": "2026-10-09T17:00:00-07:00"
        }
      ],
      "blocked": []
    },
    {
      "id": "WELD-01",
      "capabilities": [
        "weld"
      ],
      "available": [
        {
          "start": "2026-10-05T08:00:00-07:00",
          "end": "2026-10-05T12:00:00-07:00"
        },
        {
          "start": "2026-10-05T13:00:00-07:00",
          "end": "2026-10-05T17:00:00-07:00"
        },
        {
          "start": "2026-10-06T08:00:00-07:00",
          "end": "2026-10-06T12:00:00-07:00"
        },
        {
          "start": "2026-10-06T13:00:00-07:00",
          "end": "2026-10-06T17:00:00-07:00"
        },
        {
          "start": "2026-10-07T08:00:00-07:00",
          "end": "2026-10-07T12:00:00-07:00"
        },
        {
          "start": "2026-10-07T13:00:00-07:00",
          "end": "2026-10-07T17:00:00-07:00"
        },
        {
          "start": "2026-10-08T08:00:00-07:00",
          "end": "2026-10-08T12:00:00-07:00"
        },
        {
          "start": "2026-10-08T13:00:00-07:00",
          "end": "2026-10-08T17:00:00-07:00"
        },
        {
          "start": "2026-10-09T08:00:00-07:00",
          "end": "2026-10-09T12:00:00-07:00"
        },
        {
          "start": "2026-10-09T13:00:00-07:00",
          "end": "2026-10-09T17:00:00-07:00"
        }
      ],
      "blocked": []
    },
    {
      "id": "WELD-02",
      "capabilities": [
        "weld"
      ],
      "available": [
        {
          "start": "2026-10-05T08:00:00-07:00",
          "end": "2026-10-05T12:00:00-07:00"
        },
        {
          "start": "2026-10-05T13:00:00-07:00",
          "end": "2026-10-05T17:00:00-07:00"
        },
        {
          "start": "2026-10-06T08:00:00-07:00",
          "end": "2026-10-06T12:00:00-07:00"
        },
        {
          "start": "2026-10-06T13:00:00-07:00",
          "end": "2026-10-06T17:00:00-07:00"
        },
        {
          "start": "2026-10-07T08:00:00-07:00",
          "end": "2026-10-07T12:00:00-07:00"
        },
        {
          "start": "2026-10-07T13:00:00-07:00",
          "end": "2026-10-07T17:00:00-07:00"
        },
        {
          "start": "2026-10-08T08:00:00-07:00",
          "end": "2026-10-08T12:00:00-07:00"
        },
        {
          "start": "2026-10-08T13:00:00-07:00",
          "end": "2026-10-08T17:00:00-07:00"
        },
        {
          "start": "2026-10-09T08:00:00-07:00",
          "end": "2026-10-09T12:00:00-07:00"
        },
        {
          "start": "2026-10-09T13:00:00-07:00",
          "end": "2026-10-09T17:00:00-07:00"
        }
      ],
      "blocked": []
    },
    {
      "id": "PAINT-01",
      "capabilities": [
        "paint"
      ],
      "available": [
        {
          "start": "2026-10-05T08:00:00-07:00",
          "end": "2026-10-05T12:00:00-07:00"
        },
        {
          "start": "2026-10-05T13:00:00-07:00",
          "end": "2026-10-05T17:00:00-07:00"
        },
        {
          "start": "2026-10-06T08:00:00-07:00",
          "end": "2026-10-06T12:00:00-07:00"
        },
        {
          "start": "2026-10-06T13:00:00-07:00",
          "end": "2026-10-06T17:00:00-07:00"
        },
        {
          "start": "2026-10-07T08:00:00-07:00",
          "end": "2026-10-07T12:00:00-07:00"
        },
        {
          "start": "2026-10-07T13:00:00-07:00",
          "end": "2026-10-07T17:00:00-07:00"
        },
        {
          "start": "2026-10-08T08:00:00-07:00",
          "end": "2026-10-08T12:00:00-07:00"
        },
        {
          "start": "2026-10-08T13:00:00-07:00",
          "end": "2026-10-08T17:00:00-07:00"
        },
        {
          "start": "2026-10-09T08:00:00-07:00",
          "end": "2026-10-09T12:00:00-07:00"
        },
        {
          "start": "2026-10-09T13:00:00-07:00",
          "end": "2026-10-09T17:00:00-07:00"
        }
      ],
      "blocked": []
    }
  ],
  "workers": [
    {
      "id": "EMP-C01",
      "skills": [
        "cut"
      ],
      "qualifications": [],
      "available": [
        {
          "start": "2026-10-05T08:00:00-07:00",
          "end": "2026-10-05T12:00:00-07:00"
        },
        {
          "start": "2026-10-05T13:00:00-07:00",
          "end": "2026-10-05T17:00:00-07:00"
        },
        {
          "start": "2026-10-06T08:00:00-07:00",
          "end": "2026-10-06T12:00:00-07:00"
        },
        {
          "start": "2026-10-06T13:00:00-07:00",
          "end": "2026-10-06T17:00:00-07:00"
        },
        {
          "start": "2026-10-07T08:00:00-07:00",
          "end": "2026-10-07T12:00:00-07:00"
        },
        {
          "start": "2026-10-07T13:00:00-07:00",
          "end": "2026-10-07T17:00:00-07:00"
        },
        {
          "start": "2026-10-08T08:00:00-07:00",
          "end": "2026-10-08T12:00:00-07:00"
        },
        {
          "start": "2026-10-08T13:00:00-07:00",
          "end": "2026-10-08T17:00:00-07:00"
        },
        {
          "start": "2026-10-09T08:00:00-07:00",
          "end": "2026-10-09T12:00:00-07:00"
        },
        {
          "start": "2026-10-09T13:00:00-07:00",
          "end": "2026-10-09T17:00:00-07:00"
        }
      ],
      "blocked": []
    },
    {
      "id": "EMP-C02",
      "skills": [
        "cut"
      ],
      "qualifications": [],
      "available": [
        {
          "start": "2026-10-05T08:00:00-07:00",
          "end": "2026-10-05T12:00:00-07:00"
        },
        {
          "start": "2026-10-05T13:00:00-07:00",
          "end": "2026-10-05T17:00:00-07:00"
        },
        {
          "start": "2026-10-06T08:00:00-07:00",
          "end": "2026-10-06T12:00:00-07:00"
        },
        {
          "start": "2026-10-06T13:00:00-07:00",
          "end": "2026-10-06T17:00:00-07:00"
        },
        {
          "start": "2026-10-07T08:00:00-07:00",
          "end": "2026-10-07T12:00:00-07:00"
        },
        {
          "start": "2026-10-07T13:00:00-07:00",
          "end": "2026-10-07T17:00:00-07:00"
        },
        {
          "start": "2026-10-08T08:00:00-07:00",
          "end": "2026-10-08T12:00:00-07:00"
        },
        {
          "start": "2026-10-08T13:00:00-07:00",
          "end": "2026-10-08T17:00:00-07:00"
        },
        {
          "start": "2026-10-09T08:00:00-07:00",
          "end": "2026-10-09T12:00:00-07:00"
        },
        {
          "start": "2026-10-09T13:00:00-07:00",
          "end": "2026-10-09T17:00:00-07:00"
        }
      ],
      "blocked": []
    },
    {
      "id": "EMP-C03",
      "skills": [
        "cut"
      ],
      "qualifications": [],
      "available": [
        {
          "start": "2026-10-05T08:00:00-07:00",
          "end": "2026-10-05T12:00:00-07:00"
        },
        {
          "start": "2026-10-05T13:00:00-07:00",
          "end": "2026-10-05T17:00:00-07:00"
        },
        {
          "start": "2026-10-06T08:00:00-07:00",
          "end": "2026-10-06T12:00:00-07:00"
        },
        {
          "start": "2026-10-06T13:00:00-07:00",
          "end": "2026-10-06T17:00:00-07:00"
        },
        {
          "start": "2026-10-07T08:00:00-07:00",